{
  "schema_version": 1,
  "candidate_digest": "sha256:d00f365911e719b10acdfee816d98c62ab69e42962bc523a7ca214b5abb9fdb1",
  "scoped_tree_digest": "sha256:ec3162cc49e049025eb8d6b16246f1f03229830216e2e3e6d1c6c49e0fc579d1",
  "manifest_revision": 1,
  "manifest_digest": "sha256:05a2fb977a6274b6219127ab54aedb400fd26695aefae560b3c82c45a0c1cb5e",
  "immutable_inputs": [
    {"id":"l3-adaptation-manifest-29.3","kind":"manifest","digest":"sha256:05a2fb977a6274b6219127ab54aedb400fd26695aefae560b3c82c45a0c1cb5e"},
    {"id":"l7-29.4-replay-materials","kind":"materials","digest":"sha256:a97d7d0055f4c63b4fd8d75736eeaa7cc7fbb969999cb6fa2f2049b067f59426"},
    {"id":"roots-portability-and-replay-L7","kind":"plan","digest":"sha256:3c7834b71495c9a8cf80e9333e68d9826a031ad0cf0b6b850b5e6b2b92c8afeb"}
  ],
  "expected_unit_ids": [
    "roots-knots-build-ci-build-or-release",
    "roots-knots-common-maintenance",
    "roots-knots-consensus-validation-consensus-adjacent",
    "roots-knots-documentation-documentation",
    "roots-knots-gui-branding-ui",
    "roots-knots-p2p-networking",
    "roots-knots-policy-local-policy",
    "roots-knots-tests-test-coverage",
    "roots-knots-wallet-wallet",
    "roots-roots-build-ci-build-or-release",
    "roots-roots-common-maintenance",
    "roots-roots-consensus-validation-consensus-adjacent",
    "roots-roots-documentation-documentation",
    "roots-roots-gui-branding-ui",
    "roots-roots-release-generated-output",
    "roots-roots-tests-test-coverage"
  ],
  "finalized_at": "2026-09-15T05:36:41Z",
  "produced_at": "2026-09-15T08:03:52Z",
  "unit_outcomes": [
    {"id":"roots-knots-build-ci-build-or-release","status":"pass","candidate_digest":"sha256:d00f365911e719b10acdfee816d98c62ab69e42962bc523a7ca214b5abb9fdb1","scoped_tree_digest":"sha256:ec3162cc49e049025eb8d6b16246f1f03229830216e2e3e6d1c6c49e0fc579d1","manifest_digest":"sha256:05a2fb977a6274b6219127ab54aedb400fd26695aefae560b3c82c45a0c1cb5e","fixture_digest":"sha256:3bb000599c5c02af525b5cf6dfc16640f266f6d083015fbd42310acb468853ce","artifact_digest":"sha256:40d2de854392f500760cdbd7997febe691eb2b0df4b1ec3cb3b2ba6bef8c8a47","finished_at":"2026-09-15T07:55:09Z","command":"roots-replay.py replay plus GitHub Actions run 34933893819","test_identity":"downstream-unit-outcomes.json:roots-knots-build-ci-build-or-release"},
    {"id":"roots-knots-common-maintenance","status":"pass","candidate_digest":"sha256:d00f365911e719b10acdfee816d98c62ab69e42962bc523a7ca214b5abb9fdb1","scoped_tree_digest":"sha256:ec3162cc49e049025eb8d6b16246f1f03229830216e2e3e6d1c6c49e0fc579d1","manifest_digest":"sha256:05a2fb977a6274b6219127ab54aedb400fd26695aefae560b3c82c45a0c1cb5e","fixture_digest":"sha256:3bb000599c5c02af525b5cf6dfc16640f266f6d083015fbd42310acb468853ce","artifact_digest":"sha256:f4fc7985557b834594a32070ae096af7523d9c6f9ca91c516795355a57f3277e","finished_at":"2026-09-15T07:55:09Z","command":"roots-replay.py replay plus GitHub Actions run 34933893819","test_identity":"downstream-unit-outcomes.json:roots-knots-common-maintenance"},
    {"id":"roots-knots-consensus-validation-consensus-adjacent","status":"pass","candidate_digest":"sha256:d00f365911e719b10acdfee816d98c62ab69e42962bc523a7ca214b5abb9fdb1","scoped_tree_digest":"sha256:ec3162cc49e049025eb8d6b16246f1f03229830216e2e3e6d1c6c49e0fc579d1","manifest_digest":"sha256:05a2fb977a6274b6219127ab54aedb400fd26695aefae560b3c82c45a0c1cb5e","fixture_digest":"sha256:3bb000599c5c02af525b5cf6dfc16640f266f6d083015fbd42310acb468853ce","artifact_digest":"sha256:96c066dee251401e8a6c0ad2089515918d7396feb9e511680aa414b55606c926","finished_at":"2026-09-15T07:55:09Z","command":"roots-replay.py replay plus GitHub Actions run 34933893819","test_identity":"downstream-unit-outcomes.json:roots-knots-consensus-validation-consensus-adjacent"},
    {"id":"roots-knots-documentation-documentation","status":"pass","candidate_digest":"sha256:d00f365911e719b10acdfee816d98c62ab69e42962bc523a7ca214b5abb9fdb1","scoped_tree_digest":"sha256:ec3162cc49e049025eb8d6b16246f1f03229830216e2e3e6d1c6c49e0fc579d1","manifest_digest":"sha256:05a2fb977a6274b6219127ab54aedb400fd26695aefae560b3c82c45a0c1cb5e","fixture_digest":"sha256:3bb000599c5c02af525b5cf6dfc16640f266f6d083015fbd42310acb468853ce","artifact_digest":"sha256:5e88c5464d75f19eef6a48e45dee1b470bfcbed1e065c06183262cba595a171e","finished_at":"2026-09-15T07:55:09Z","command":"roots-replay.py replay plus GitHub Actions run 34933893819","test_identity":"downstream-unit-outcomes.json:roots-knots-documentation-documentation"},
    {"id":"roots-knots-gui-branding-ui","status":"pass","candidate_digest":"sha256:d00f365911e719b10acdfee816d98c62ab69e42962bc523a7ca214b5abb9fdb1","scoped_tree_digest":"sha256:ec3162cc49e049025eb8d6b16246f1f03229830216e2e3e6d1c6c49e0fc579d1","manifest_digest":"sha256:05a2fb977a6274b6219127ab54aedb400fd26695aefae560b3c82c45a0c1cb5e","fixture_digest":"sha256:3bb000599c5c02af525b5cf6dfc16640f266f6d083015fbd42310acb468853ce","artifact_digest":"sha256:8966611bfc8ff002d422c83f2f354a5f045395e9e599a2ea2e75d79b0b43cce3","finished_at":"2026-09-15T07:55:09Z","command":"roots-replay.py replay plus GitHub Actions run 34933893819","test_identity":"downstream-unit-outcomes.json:roots-knots-gui-branding-ui"},
    {"id":"roots-knots-p2p-networking","status":"pass","candidate_digest":"sha256:d00f365911e719b10acdfee816d98c62ab69e42962bc523a7ca214b5abb9fdb1","scoped_tree_digest":"sha256:ec3162cc49e049025eb8d6b16246f1f03229830216e2e3e6d1c6c49e0fc579d1","manifest_digest":"sha256:05a2fb977a6274b6219127ab54aedb400fd26695aefae560b3c82c45a0c1cb5e","fixture_digest":"sha256:3bb000599c5c02af525b5cf6dfc16640f266f6d083015fbd42310acb468853ce","artifact_digest":"sha256:76bcfb4450295d2ef7db8edf36448cede530e9d99b17f35b48d52d982a5befb3","finished_at":"2026-09-15T07:55:09Z","command":"roots-replay.py replay plus GitHub Actions run 34933893819","test_identity":"downstream-unit-outcomes.json:roots-knots-p2p-networking"},
    {"id":"roots-knots-policy-local-policy","status":"pass","candidate_digest":"sha256:d00f365911e719b10acdfee816d98c62ab69e42962bc523a7ca214b5abb9fdb1","scoped_tree_digest":"sha256:ec3162cc49e049025eb8d6b16246f1f03229830216e2e3e6d1c6c49e0fc579d1","manifest_digest":"sha256:05a2fb977a6274b6219127ab54aedb400fd26695aefae560b3c82c45a0c1cb5e","fixture_digest":"sha256:3bb000599c5c02af525b5cf6dfc16640f266f6d083015fbd42310acb468853ce","artifact_digest":"sha256:77ec298061fb82090128460ef447f31046e50aba2aabd84189600f8eb7bd98bb","finished_at":"2026-09-15T07:55:09Z","command":"roots-replay.py replay plus GitHub Actions run 34933893819","test_identity":"downstream-unit-outcomes.json:roots-knots-policy-local-policy"},
    {"id":"roots-knots-tests-test-coverage","status":"pass","candidate_digest":"sha256:d00f365911e719b10acdfee816d98c62ab69e42962bc523a7ca214b5abb9fdb1","scoped_tree_digest":"sha256:ec3162cc49e049025eb8d6b16246f1f03229830216e2e3e6d1c6c49e0fc579d1","manifest_digest":"sha256:05a2fb977a6274b6219127ab54aedb400fd26695aefae560b3c82c45a0c1cb5e","fixture_digest":"sha256:3bb000599c5c02af525b5cf6dfc16640f266f6d083015fbd42310acb468853ce","artifact_digest":"sha256:806d2e0b109dcc6a2c082b20ba6a436fd4582cd84e42f83630f11b477399f895","finished_at":"2026-09-15T07:55:09Z","command":"roots-replay.py replay plus GitHub Actions run 34933893819","test_identity":"downstream-unit-outcomes.json:roots-knots-tests-test-coverage"},
    {"id":"roots-knots-wallet-wallet","status":"pass","candidate_digest":"sha256:d00f365911e719b10acdfee816d98c62ab69e42962bc523a7ca214b5abb9fdb1","scoped_tree_digest":"sha256:ec3162cc49e049025eb8d6b16246f1f03229830216e2e3e6d1c6c49e0fc579d1","manifest_digest":"sha256:05a2fb977a6274b6219127ab54aedb400fd26695aefae560b3c82c45a0c1cb5e","fixture_digest":"sha256:3bb000599c5c02af525b5cf6dfc16640f266f6d083015fbd42310acb468853ce","artifact_digest":"sha256:e34b717d793e2d56989f0630f5e0e85a6e33acf2fd7b8350baccba43bf6c34a4","finished_at":"2026-09-15T07:55:09Z","command":"roots-replay.py replay plus GitHub Actions run 34933893819","test_identity":"downstream-unit-outcomes.json:roots-knots-wallet-wallet"},
    {"id":"roots-roots-build-ci-build-or-release","status":"pass","candidate_digest":"sha256:d00f365911e719b10acdfee816d98c62ab69e42962bc523a7ca214b5abb9fdb1","scoped_tree_digest":"sha256:ec3162cc49e049025eb8d6b16246f1f03229830216e2e3e6d1c6c49e0fc579d1","manifest_digest":"sha256:05a2fb977a6274b6219127ab54aedb400fd26695aefae560b3c82c45a0c1cb5e","fixture_digest":"sha256:3bb000599c5c02af525b5cf6dfc16640f266f6d083015fbd42310acb468853ce","artifact_digest":"sha256:3954c9ddd5e0d53c045a87358c54fa85195a9a48453303d823765ce4847e5221","finished_at":"2026-09-15T07:55:09Z","command":"roots-replay.py replay plus GitHub Actions run 34933893819","test_identity":"downstream-unit-outcomes.json:roots-roots-build-ci-build-or-release"},
    {"id":"roots-roots-common-maintenance","status":"pass","candidate_digest":"sha256:d00f365911e719b10acdfee816d98c62ab69e42962bc523a7ca214b5abb9fdb1","scoped_tree_digest":"sha256:ec3162cc49e049025eb8d6b16246f1f03229830216e2e3e6d1c6c49e0fc579d1","manifest_digest":"sha256:05a2fb977a6274b6219127ab54aedb400fd26695aefae560b3c82c45a0c1cb5e","fixture_digest":"sha256:3bb000599c5c02af525b5cf6dfc16640f266f6d083015fbd42310acb468853ce","artifact_digest":"sha256:3083b68370c6f8d13327a083d5db994042e07e1dec291ef318814323da77f3f5","finished_at":"2026-09-15T07:55:09Z","command":"roots-replay.py replay plus GitHub Actions run 34933893819","test_identity":"downstream-unit-outcomes.json:roots-roots-common-maintenance"},